{
  "$schema": "https://raw.githubusercontent.com/felipecarrillo100/cloudfrontize/main/schema/cloudfrontize.schema.json",
  "version": 1,
  "name": "Template",
  "origins": [
    {
      "id": "website",
      "type": "local",
      "path": "origins/www"
    }
  ],
  "functions": {
    "security-headers": {
      "type": "cloudfront-function",
      "runtime": "cloudfront-js-2.0",
      "file": "functions/cloudfront/viewer-response.security-headers.js"
    }
  },
  "defaultBehavior": {
    "origin": "website",
    "functions": {
      "viewer-response": "security-headers"
    }
  }
}
