{
  "$schema": "https://raw.githubusercontent.com/felipecarrillo100/cloudfrontize/main/schema/cloudfrontize.schema.json",
  "version": 1,
  "name": "2.1 The Scientist",
  "origins": [
    {
      "id": "website",
      "type": "local",
      "path": "origins/www"
    }
  ],
  "functions": {
    "scientist": {
      "type": "lambda-edge",
      "runtime": "nodejs22.x",
      "file": "functions/lambda-edge/origin-request.scientist.js"
    }
  },
  "defaultBehavior": {
    "origin": "website",
    "functions": {
      "origin-request": "scientist"
    }
  }
}
